<?xml version="1.0" encoding="UTF-8"?>
<xs:schema xmlns:xs="http://www.w3.org/2001/XMLSchema">
    <xs:element name="register_form">
        <xs:complexType>
            <xs:sequence>
                <xs:element name="user" maxOccurs="unbounded">
                    <xs:complexType>
                        <xs:sequence>
                            <xs:element name="full_name" type="xs:string" />
                            <xs:element name="phone_number">
                                <xs:complexType mixed="true">
                                    <xs:sequence minOccurs="0">
                                        <xs:element name="p1" minOccurs="0" type="xs:string" />
                                        <xs:element name="p2" minOccurs="0" type="xs:string" />
                                    </xs:sequence>
                                </xs:complexType>
                            </xs:element>
                            <xs:element name="DOB" type="xs:string" />
                            <xs:element name="email" type="xs:string" />
                            <xs:element name="password" type="xs:string" />
                            <xs:element name="confirm_password" type="xs:string" />
                            <xs:element name="gender" type="xs:string" />
                        </xs:sequence>
                        <xs:attribute name="id" type="xs:integer" use="required" />
                    </xs:complexType>
                </xs:element>
            </xs:sequence>
        </xs:complexType>
    </xs:element>
</xs:schema>